track,artist,genre,lyrics
Begin Again,Jessie Ware,Pop,"20 ContributorsTranslationsPortuguêsBegin Again Lyrics[Chorus]
I work all night
I do my thing
Just killin' time
Need a friend
Is this my life?
Beginning or end?
Can I start again?
Can we start again?

[Verse 1]
There's a new moon on the rise
Turn the tide, turn the tide
I've been walking a thin line
Between the Earth and the sky

[Pre-Chorus]
Why do my realities take over all my dreams?
Why does all the purest love get filtered through machines?
Give me something good that's even better than it seems
Why does all the purеst love get filterеd through machines?

[Chorus]
I work all night (I work all night)
I do my thing (I do my thing)
Just killin' time (Just killin' time)
Need a friend (A friend)
Is this my life?
Beginning or end? (Beginning or end?)
Can I start again? (Can we begin again?)
Can we start again? (Can we begin again?)
See Jessie Ware LiveGet tickets as low as $71You might also like[Verse 2]
There's a new sun in the sky
Where are you? Where am I?
Have you been looking like I've been looking for a reason or a sign?
Oh, why? Oh, why?

[Pre-Chorus]
Why do my realities take over all my dreams?
Why does all the purest love get filtered through machines?
Give me something good that's even better than it seems
Why does all the purest love get filtered through machines?

[Chorus]
I work all night (I work all night)
I do my thing (I do my thing)
Just killin' time (Just killin' time)
Need a friend (A friend)
Is this my life?
Beginning or end? (Beginning or end?)
Can I start again? (Can we begin again?)
Can we start again? (Can we begin again?)

[Bridge]
Can we begin again and be who we were at the start, at the start again? (Can we begin?)
Can we begin again and be who we were at the start, at the start again? (Ooh, the start)
Can we begin again and be who we were at the start, at the start again?
Can we begin again and be who we were at the start, at the start again?
Can we begin again and be who we were at the start, at the start again? (Who we were, killing time)
Can we begin again and be who we were at the start, at the start again? (We're just killing time)
Can we begin again and be who we were at the start, at the start again? (Can we begin again? Again?)
Can we begin again and be who we were at the start, at the start again? (Again?)
Can we begin again and be who we were at the start, at the start again? (I work all night)
Can we begin again and be who we were at the start, at the start again? (Do my thing; can we begin?)
Can we begin again and be who we were at the start, at the start again? (Just killin' time)
Can we begin again and be who we were at the start, at the start again? (Too hard, all night, all night)
Can we begin again?  (I work too hard, oh)
Can we begin again? (Beginning or end? Woah)
Can we begin again? (Moving time)
Can we begin again? (Moving time)
[Instrumental Break]

[Outro]
Why do my realities take over all my dreams?
Why does all the purest love get filtered through machines?
Give me something good that's even better than it seems
Why does all the purest love get filtered through machines?
Can we begin again?
Can we begin again?
Can we begin again?
Can we begin again?1Embed"
Red Wine Supernova,Chappell Roan,Pop,"29 ContributorsTranslationsEspañolPortuguêsFrançaisRed Wine Supernova Lyrics[Verse 1]
She was a playboy, Brigitte Bardot
She showed me things I didn't know
She did it right there out on the deck
Put her canine teeth in the side of my neck
I'm in the hallway waitin' for ya
Mini skirt and my go-go boots (Uh-Uh)
I just want you to make a move
So slow down, sit down, it's new

[Pre-Chorus]
I just wanna get to know ya
Guess I didn't quite think it through (Nah-uh, girl)
Fell in love with the thought of you
Now I'm choked up, face down, burnt out

[Chorus]
Baby, why don't you come over?
Red wine supernova, falling into me
(Let's pick it up now)
I don't care that you're a stoner
Red wine supernova, fall right into me

[Verse 2]
I like (I like)
What you like (What you like)
Long hair (No bra)
It's my type (That's right)
You just told me
Want me to fuck you
Baby, I will 'cause I really want to
See Chappell Roan LiveGet tickets as low as $112You might also like[Pre-Chorus]
I just wanna get to know ya
Guess I didn't quite think it through (Nah-uh, girl)
Fell in love with the thought of you
Now I'm choked up, face down, burnt out

[Chorus]
Baby, why don't you come over?
Red wine supernova, falling into me
(Okay, y'all, let's pick it up now)
I don't care that you're a stoner
Red wine supernova, fall right into me

[Bridge]
Well, back at my house
I've got a California king
Okay, maybe it's a twin bed
And some roommates (Don't worry, we're cool)
I heard you like magic
I've got a wand and a rabbit
So baby, let's get freaky, get kinky
Let's make this bed get squeaky

[Chorus]
Baby, why don't you come over?
Red wine supernova, falling into me
I don't care that you're a stoner
Red wine supernova, fall right into me3Embed"
Jim Carrey,Charlotte Cardin,Pop,"6 ContributorsJim Carrey Lyrics[Intro]
Jim Carrey, will you marry me?

[Verse 1]
Call me when you get this
I've been thinkin' a little recklessly
Checking off a hit list
Actin' like I'm headless
I don't wanna let this be
And I've been runnin' endlessly
Misguided by my jealousy

[Pre-Chorus]
It's like my dreams are turning on me
I'm my worst enemy
This may be the end of me
I got so many personalities
Jim Carrey, will you marry me?
Jim Carrey, will you marry me?
Marry me, yeah

[Chorus]
Goodbye my worthless ego
Without you I'm finally free, oh
Goodbye my worthless ego
Without you I'm finally free, oh
See Charlotte Cardin LiveGet tickets as low as $53You might also like[Verse 2]
Never thought I'd say this
But everything I thought was me
Was just another daydream
Runnin' through the daisies
Felt like it was meant to be
But I was fallin' helplessly
Blind sighted by my vanity

[Pre-Chorus]
It's like my dreams are turning on me
I'm my worst enemy
This may be the end of me
I got so many personalities
Jim Carrey, will you marry me?
Jim Carrey, will you marry me?
Marry me, yeah

[Chorus]
Goodbye my worthless ego
Without you I'm finally free, oh
Goodbye my worthless ego
Without you I'm finally free, oh

[Bridge]
Jim Carrey, will you marry me?
It's like my dreams are turning on me
I'm my worst enemy
This may be the end of me
I got so many personalities
Jim Carrey, will you marry me?
Jim Carrey, will you marry me?
Marry me, yeah
[Chorus]
Goodbye my worthless ego
Without you I'm finally free, oh
Goodbye my worthless ego
Without you I'm finally free, oh
Goodbye my worthless ego
Without you I'm finally free, oh
Goodbye my worthless ego
Without you I'm finally free, ohEmbed"
VICIOUS,Thomas Day,Pop,"3 ContributorsVICIOUS Lyrics[Verse 1]
I'm jealous of all your friends 'cause they still get to look at you
I mean, they still get to talk to you, and I can't do that anymore
I hate the kid you met 'cause he was way too nice to you
And I'll always be nice to you, but I'm not that kid anymore

[Pre-Chorus]
I'm hanging on by a thread
And you don't want it to end

[Chorus]
I wish we could go back to the way it was
But I've got my own eyes
I've seen enough, all the damage
If you're gonna leave me lonely
If you're giving up on us
If you've got somebody else
Don't tell me that you love me

[Verse 2]
Remember the time you said that there was something wrong with me?
There must be something wrong with me 'cause I let you stay in my life
All your feelings came with all of their conditions
So, shut up and listen, but I didn't pay for the ride

[Pre-Chorus]
I'm hanging on by a thread
And you don't want it to end
You might also like[Chorus]
I wish we could go back to the way it was
But I've got my own eyes
I've seen enough, all the damage
If you're gonna leave me lonely
If you're giving up on us
If you've got somebody else
Don't tell me that you love me

[Post-Chorus]
Ooh
Ooh, don't tell me that you love me

[Bridge]
Thinking about all of the memories I'd visit
Hoping they'll just slowly fade away
And maybe it's my fault, I knew you were always vicious
I just didn't know it was a game
For you-ooh-ooh
You-ooh-ooh

[Chorus]
I wish we could go back to the way it was
But I've got my own eyes
I've seen enough, all the damage
If you're gonna leave me lonely
If you're giving up on us
If you've got somebody else
Don't tell me that you love meEmbed"
It Is What It Is,Jenna Raine,Pop,"7 ContributorsTranslationsEnglishIt Is What It Is Lyrics[Verse 1]
Shrunk all my clothes in the washing machine
Running on two or three hours of sleep (Clearly)
There's a light flashing in my car, I don't know what it means
You know what I mean?
Thought I knew chaos, then I turned eighteen

[Pre-Chorus]
Oh-oh-oh, oh-oh, oh-oh-oh-oh
It's kinda overwhelming but

[Chorus]
Hey! Lemons make lemonade
Flowers bloom in the rain
Growing up is a pain
And it is what it is
Okay! It's not the end of the world
There's always light where it burns
Just remember the words
And it goes like this
It is what it is, what it is, what it is, what it is
It is what it is, what it is, what it is, what it is

[Verse 2]
It's kinda weird, kinda fun
I'm a speck on a rock
(Ooh-ooh-ooh, ooh-ooh-ooh)
You can laugh, you can dance
With your stomach in knots
(Ooh-ooh-ooh, ooh-ooh-ooh)
You can trip, you can slip
You can fall down again, again, again and again
And it all works out in the end
You might also like[Pre-Chorus]
Oh-oh-oh, oh-oh, oh-oh-oh-oh
It's kinda overwhelming but

[Chorus]
Hey! Lеmons make lemonade
Flowеrs bloom in the rain
Growing up is a pain
And it is what it is
Okay! (Okay!) It's not the end of the world
There's always light where it burns
Just remember the words
And it goes like this
It is what it is, what it is, what it is, what it is
It is what it is, what it is, what it is, what it is

[Post-Chorus]
(Oh-oh-oh-oh-oh)
Na-na-na, na-na-na-na, na-na
(Hey-hey! Hey-hey!)
Na-na-na, na-na-na-na, na-na
(Oh, oh-oh-oh-oh)

[Chorus]
Hey! Lemons make lemonade
Flowers bloom in the rain
Growing up is a pain
And it is what it is
Okay! (Okay!) It's not the end of the world
There's always light where it burns
Just remember the words
And it goes like thisEmbed"
Tummy Hurts,Reneé Rapp,Pop,"22 ContributorsTranslationsFrançaisEspañolTummy Hurts Lyrics[Verse 1]
Maybe I should try religion
'Cause, Jesus, you're hard to rely on
I'd never find you in the kitchen
You couldn't even pay rent for three months

[Pre-Chorus]
Oh, I heard you, I get it, you're broke
But oh, you always had money to smoke, though

[Chorus]
Now my tummy hurts, he's in love with her
But for what it's worth, they'd make beautiful babies
And raise 'em up to be a couple of
Fucking monsters, like their mother and their father
Eventually, 2043
Someone's gonna hurt their little girl like thеir daddy hurt me

[Verse 2]
I just want some recognition
For having good tits and a big hеart
I can't believe I let you hit it
In hindsight, that might be the worst part

[Pre-Chorus]
Oh, I taught you everything you know
But oh, I guess boys, they come and they go
You might also like[Chorus]
Now my tummy hurts, he's in love with her
But for what it's worth, they'd make beautiful babies
And raise 'em up to be a couple of
Fucking monsters, like their mother and their father
Eventually, 2043
Someone's gonna hurt their little girl like their daddy hurt me

[Bridge]
Mm, like their daddy hurt (Me-e-e-e-e-e-e-e, e-e-e-e-e-e-e-e)
Like their daddy hurt (Me-e-e-e-e-e-e-e, e-e-e-e-e-e-e-e)
Like their daddy hurt (Me-e-e-e-e-e-e-e, e-e-e-e-e-e-e-e)
Like their daddy hurt (Me-e-e-e-e-e-e-e, e-e-e-e-e-e-e-e-e-e-e-e-e-e-e)

[Chorus]
Now my tummy hurts, he's in love with her
But for what it's worth, he's her problem now, baby
And she'll stay with him
'Cause she made with him a couple monsters
Like their mother and their father
Yeah, eventually, 2043
Someone's gonna hurt your little girl like you hurt meEmbed"
Bite Marks,Ari Abdul,Pop,"6 ContributorsBite Marks Lyrics[Verse 1]
Breathe in my innocence
Blow out my light (My light)
Sleep in my warm essence
Hold down your knife

[Chorus]
You left your bite marks on my ribs
No bruises feel as good as this
God loves to watch her angel's sin
I'm finding heaven in your skin

[Verse 2]
Tuck in your rosary
Say I'm your saint (Your saint)
Darling, you torture me
Give me a taste

[Chorus]
You left your bite marks on my ribs
No bruises feel as good as this
God loves to watch her angel's sin
I'm finding heaven in your skin
You left your bite marks on my ribs
Just let it out what crawls within
You dig your fangs into my lips
I like the pain, the devil's kiss
You might also like[Verse 3]
Te deseo, mi amor
You're everything that I adore
Y tu cuerpo es divino
Quédate, mi cariño

[Chorus]
You left your bite marks on my ribs
No bruises feel as good as this
God loves to watch her angel's sin
I'm finding heaven in your skin
You left your bite marks on my ribs
Just let it out what crawls within
You dig your fangs into my lips
I like the pain, the devil's kissEmbed"
VAN GOGH,METTE,Pop,"10 ContributorsVAN GOGH Lyrics[Chorus]
I'm motivated by the way you move
Got me fixated on everything you do, yeah
Ain’t no bussin' to the music without you
I could be Van Gogh, shawty, if you, if you

[Verse 1]
Fizz it up like pink champagne
How you make me make it rain
Oh yeah, oh yeah
Oh yeah, oh yeah
When I got you next to me
I'm hatchin’ a masterpiece
Oh yeah, oh yeah
Oh yeah, oh yeah

[Pre-Chorus]
I see you toss your hips, sway, then dip, it's a motion
You got your edges laid down like queen Janet Jackson
No fucks to give, go on, cast spells like a mystic
I don't wanna miss it

[Chorus]
Tonight, I'm (Ooh)
I'm motivated by the way you move
Got me fixated on everything you do, yeah
Ain't no bussin' to the music without you
I could be Van Gogh, shawty, if you'd be my muse
Don’t go dressin’ up for anyone but me
You got poet dreams in every word you speakin'
I could go sky rocket if you light the fuse
I could be Van Gogh, shawty, if you’d be my muse
You might also like[Post-Chorus]
(Let's go)

[Verse 2]
I know
I'm comin' off strong, these feelings are gettin’ heavy for you
But I know
You're my new vice, the whipped cream and the cherry on top
(I like my cherries on top)

[Pre-Chorus]
I said, ""Between now and then, I'ma need you forever""
She said, ""I don't know, I'm hot and cold, depends on the weather""
I guess I'm gonna have to think fast and pull it together
'Cause it's now or never

[Chorus]
Tonight, I'm (Ooh)
I'm motivated by the way you move
Got me fixated on everything you do, yeah
Ain't no bussin' to the music without you
I could be Van Gogh, shawty, if you'd be my muse
Don't go dressin' up for anyone but me
You got poet dreams in every word you speakin'
I could go sky rocket if you light the fuse
I could be Van Gogh, Van Gogh
[Bridge]
Ooh, ooh, ooh, ooh
When you turn around, I'm crushin' like that
Worked it out, I'm crushin' like that
Hit me now, like that

[Chorus]
I'm motivated by the way you move (Motivated)
Got me fixated on everything you do, yeah
Ain't no bussin' to the music without you
I could be Van Gogh

[Outro]
Dance, dance
I could be Van, Van
Dance, dance
GoghEmbed"
21 Days,Lauren Daigle,Pop,"2 Contributors21 Days Lyrics[Verse 1]
How far do you go when you look for love?
How long does it take before you give up?
Do you see rays from up above?
Does it only happen once?

[Verse 2]
Is it like running in the rain?
Is it like Sunday morning shame?
Is it like fire when you dance? (Dance)
When you give love a chance

[Chorus]
Tell me, how long
Do you have to be strong?
Do you have to hold on
Before you walk away?
Tell me, how come
All the feelings go numb
When it comes to Your love?
What's it gonna take?
21 days
21 days

[Verse 3]
Is it a dream that you set free (You set free)
Or hold in your hands so tightly?
Is it a wish that you rеgret?
Waiting for happiness
See Lauren Daigle LiveGet tickets as low as $34You might also like[Chorus]
Tell mе, how long
Do you have to be strong?
Do you have to hold on
Before you walk away?
Tell me, how come
All the feelings go numb
When it comes to Your love?
What's it gonna take?
21 days

[Bridge]
Oh, ooh

[Chorus]
Tell me, how long
Do you have to be strong?
Do you have to hold on
Before you walk away?
Oh, tell me, how come
All the feelings go numb
When it comes to Your love?
Do I leave or do I stay?
21 days
21 days
[Outro]
How far do you go when you look for love?Embed"
Joni,Meg Smith,Pop,"1 ContributorJoni Lyrics[Verse 1]
Lying on the floor listening to ""Case of You"" in your headphones
Little did I know, it meant more to me
And I couldn't see you wanted me to go home
Driving on the 405 talking 'bout our new apartment
Guess it's just hard when it meant more to me
In that passenger seat, now I live alone

[Pre-Chorus]
If I had cared a bit less
Would you care a bit more?

[Chorus]
Oh, Joni, how could you?
All that I ever did was try to love you
Never thought I'd see you lost in my rearview
Somehow so far, still breaking my heart
Over and over again

[Verse 2]
I count up all the ways that it's my fault but I nеver count yours
To keep you a sweet thing, to keep you from leaving
I called you to talk and you callеd me a chore
I don't know you anymore

[Chorus]
Joni, how could you?
All that I ever did was try to love you
Never thought I'd see you lost in my rearview
Somehow so far, still breaking my heart
Over and over again
You might also like[Post-Chorus]
Oh-oh, Joni, how could you?
Oh-oh, ooh
Oh-oh, Joni, how could you?
Oh-oh

[Bridge]
If I had cared a bit less
Would you care a bit more?
If it wasn't all for the best
Then what was it all for?

[Breakdown]
Oh Joni, how could you?
I was just trying to love you
Now you're lost in my rearview
Somehow so far, still breaking my heart

[Chorus]
Oh, Joni, how could you
Leave and take all of my favorite songs with you?
I don't hate you, but I hate that I miss you
Somehow so far, you're breaking my heart
Over and over again

[Post-Chorus]
Oh-oh, Joni, how could you?
Oh-oh, ooh
(It wasn't all for the best)
Oh-oh, Joni, how could you?
(What was it for?)
Oh-oh, Joni, how could you?
(If I had cared a bit less)
(Would you care a bit more?)
Oh-oh, ooh
Oh-oh, Joni, how could you?
(If it wasn't all for the best)
(What was it for?)
Oh-oh, ooh
[Outro]
Tell me what was it for?Embed"
So I Danced,DPR IAN,Pop,"7 ContributorsTranslationsРусскийItalianoSo I Danced Lyrics[Intro]
I just hope that someday someone would love me

[Verse 1]
There's no hellos
On our way to the show
Your sweet face is turnin' cold
As the fires begin to draw a little closer

[Refrain]
I left all the water running at home (Oh, shit)
Then drove around with a car that we stole
All of a sudden, they just wanted to know
How I really feel

[Chorus]
So I just danced
(Feel you)
(Feel you)
(Feel you)
I just danced
(Feel you)
(Feel you)

[Verse 2]
(Rrru!) Hello (Uh), your beautiful roses are flat
Flamingos are turnin' into giant pink rats (Uh)
Let me know how many knives are in my back
Don't get cold, your world is just about to crack (Ooh!)
You might also like[Refrain]
I left all the water running at home (Oh, shit)
Then drove around with a car that we stole
All of a sudden, they just wanted to know
How I really feel

[Chorus]
So I just danced
(Feel you)
(Feel you)
(Feel you)
I just danced
(Feel you)
(Feel you)

[Interlude]
I never thought it would come to this (Woo!)
What, you like them struggles? (Hoo!)
It's not your end of the story
God, this shit sucks (MITO)
(Hoo!)
(Hoo!)
I'm going

[Refrain]
I left all the water runnin' at home
Then drove around with a car that we stole
All of a sudden, they just wanted to know
This is how I really feel
[Outro]
This is how I really feel
So I just danced1Embed"
uhoh,Kim Petras,Pop,"24 ContributorsTranslationsEspañol​uhoh Lyrics[Intro]
Yeah

[Verse 1]
When I'm in the place and the rate goes up
When I'm in the place and the bass goes up
I'ma get you undone, undone (Up)
When I'm in the place and the rave go up
I know that you want some, want some (Up)
In Atlanta and in London (Up)
You gon' feel it when you wake up (Up)
You gon' wake up in your make up

[Chorus]
Everything I drop is a banger
Every time I hop out the Phantom
I step in the place, baby, let's go
When they turn their heads, they go ""uh oh""
Get your back off, back off the wall
Hands up, spill your drink on thе floor
Everything I drop is a banger
Everything I drop is a bangеr

[Post-Chorus]
Yeah, oh
You already know, oh
I'ma keep it up, oh
And your girl go ""uh oh""
You might also like[Verse 2]
I just wanna fuck up the place
I just wanna fuck up the place
Baby, put your hand on my waist
Lady, get the fuck out the way

[Chorus]
Everything I drop is a banger
Every time I hop out the Phantom
I step in the place, baby, let's go
When they turn their heads, they go ""uh oh""
Go get off your phone, read the room
Every call I'm on is a check
Turn the heat up, sweat off your face
I won't let the drugs go to waste
Everything I drop is a banger
Everything I drop is a banger
When I pull up, God save the rave
Tell me can you handle me?

[Post-Chorus]
(Everything I drop is a banger)

[Refrain]
I just wanna fuck up the, fuck up the, fuck up the—
I just wanna fuck up the place (Baby)
Lady, get the fuck out the, fuck out the, fuck out the—
Lady, get the fuck out the way
I just wanna fuck up the, fuck up the, fuck up the—
I just wanna fuck up the place (Baby)
Lady, get the fuck out the, fuck out the, fuck out the—
Lady, get the fuck out the way
[Chorus]
Everything I drop is a banger
Every time I hop out the Phantom
I step in the place, baby, let's go
When they turn their heads, they go ""uh oh""
Get your back off, back off the wall
Hands up, spill your drink on the floor
Everything I drop is a banger
Everything I drop is a banger (Let's go, let's go)

[Post-Chorus]
(Everything I drop is a banger)
Yeah, oh
You already know, oh
I'ma keep it up, oh
And your girl go ""uh oh""
Yeah, oh
You already know, oh
I'ma keep it up, oh
And your girl go ""uh oh""

[Refrain]
I just wanna fuck up the, fuck up the, fuck up the—
I just wanna fuck up the place
Lady, get the fuck out the, fuck out the, fuck out the—
Lady, get the fuck out the way (Woo)
Everything I drop
Everything I drop
Everything I drop
Everything I drop (Drop is a banger)
[Outro]
Everything I drop is a banger
Every time I hop out the Phantom
I step in the place, baby, let's go
When they turn their heads, they go ""uh oh""1Embed"
