track,artist,genre,lyrics
Next Thing You Know,Jordan Davis,Country,"10 ContributorsNext Thing You Know Lyrics[Verse 1]
You swear that you're stayin' single, next thing you know
You meet a girl at a bar and next thing you know
You get her laughin', it's 2AM
You're tellin' your buddies, three months in
That she ain't movin' in, the next thing you know
There's a U-Haul trailer, the next thing you know
Your old apartment, is y'all's new place
There goes the carpet but the deer head stays

[Chorus]
Next thing you know
You're savin' money like never before, just to
Spend it all at a jewelry store
Gettin' down on one knee on hеr mama's porch
Just prayin' she don't say, ""No""
Next thing you know
Your best man givеs a half-drunk speech and you're
Sunburnt on a honeymoon beach and your
Left hand's gettin' used to that ring
And there the next two or three years go
Next thing you know

[Verse 2]
You weren't really tryin', next thing you know
There's a test on the counter, next thing you know
She's standin' there cryin', noddin' her head yes
You're half excited, half scared to death
See Jordan Davis LiveGet tickets as low as $20You might also like[Chorus]
'Cause next thing you know
You're wearin' scrubs and a funny white hat and the
Doctor's sayin', how you doin' there dad and
Nobody's ever called you that
And you take that drive home slow
Next thing you know
It's first steps, first dates, first car
It's 11:01 wonderin' where they are
You're sayin' that USC's too far
It's amazing how fast seventeen years go
Next thing you know
Next thing you know

[Bridge]
Next thing you know
You get to know your wife again and you're
More in love than you've ever been
With a lot of years of remember when's and still some down the road

[Chorus]
'Cause next thing you know
You got a yard full of your kid's kids
And you take 'em to church, teach 'em to fish
And you, tell 'em stories every chance you get
About how fast this life down here can go
Next thing you know
(Next thing you know, ooh)
Next thing you know
(Next thing you know, ooh)Embed"
Pretty Little Poison,Warren Zeiders,Country,"9 ContributorsPretty Little Poison Lyrics[Verse 1]
Every night, 'round about this time
It's like she knows I'm lonely
Rolls up when the wine is gone
Like a record on repeat
Leanin' on old memories
And talkin' 'bout what used to be
She'll probably be the death of me
But damn if it ain't sweet

[Chorus]
She's my pretty little poison
My heartache in the night
With a kiss on her lips just like cyanide
Yeah, she came with a warnin'
But I didn't mind
I'll go out on that high every time
She's my pretty little poison
My pretty littlе poison

[Verse 2]
Shadows dancin' down the hall
Whispers that she wants mе
Try my best not to fall
When she falls into me
We all need some kind of fix
For me, she's the one I'll pick
Nothin' else will do the trick
She's all I need
See Warren Zeiders LiveGet tickets as low as $51You might also like[Chorus]
She's my pretty little poison
My heartache in the night
With a kiss on her lips just like cyanide
Yeah, she came with a warnin'
But I didn't mind
I'll go out on that high every time
She's my pretty little poison
My pretty little poison

[Bridge]
For some, I guess it's alcohol
I don't want none at all
I just want you
No, I just want you

[Chorus]
My pretty little poison
My heartache in the night
With a kiss on her lips just like cyanide
Yeah, she came with a warnin'
But I didn't mind
I'll go out on that high every time
She's my pretty little poison
My pretty little poison
She's my pretty little poisonEmbed"
Before He Cheats,Carrie Underwood,Country,"70 ContributorsBefore He Cheats Lyrics[Verse 1]
Right now, he's probably slow dancing
With a bleached-blonde tramp
And she's probably getting frisky
Right now, he's probably buying her some fruity little drink
'Cause she can't shoot a whiskey
Right now, he's probably up behind her with a pool-stick
Showing her how to shoot a combo
And he don't know

[Chorus]
I dug my key into the side
Of his pretty little souped up four-wheel drive
Carved my name into his leather seats
I took a Louisville Slugger to both headlights
Slashed a hole in all four tires
Maybe next time, he'll think before he cheats

[Verse 2]
Right now, she's probably up singing some
White-trash version of Shania karaoke
Right now, she's probably saying, ""I'm drunk""
And he's a thinking that he's gonna get lucky
Right now, he's probably dabbing on
Three dollars worth of that bathroom Polo
Oh, and he don't know
See Carrie Underwood LiveGet tickets as low as $112You might also like[Chorus]
Oh, that I dug my key into the side
Of his pretty little souped up four-wheel drive
Carved my name into his leather seats
I took a Louisville Slugger to both headlights
Slashed a hole in all four tires
Maybe next time, he'll think before he cheats

[Bridge]
I might've saved a little trouble for the next girl
'Cause the next time that he cheats
Oh, you know it won't be on me
No, not on me

[Chorus]
'Cause I dug my key into the side
Of his pretty little souped up four-wheel drive
Carved my name into his leather seats
I took a Louisville Slugger to both headlights
Slashed a hole in all four tires
Maybe next time, he'll think before he cheats

[Outro]
Oh, maybe next time, he'll think before he cheats
Oh, before he cheats
Oh29Embed"
What He'll Never Have,Dylan Scott,Country,"3 ContributorsWhat He’ll Never Have Lyrics[Verse 1]
Girl, I meant what I said
When I said, ""I do.""
Yeah, through thick or thin
I'd spend forever with you
But if I leave this world
Baby, a little too soon
It hurts like hell to say, ""I hope you find someone new.""

[Chorus]
He can have my truck, sitting out in the drive
He can have this house, everything inside
My favorite fishing hole and my old dog too
But what he'll never have is the love I have for you

[Verse 2]
Girl, I hope and pray
You and me grow old
Few lines on our face
Few million stories told
But if I leavе this place
Find another hand to hold
It hurts like hеll to say, but make sure he knows

[Chorus]
He can have my truck, sitting out in the drive
He can have this house, everything inside
My favorite fishing hole and my old dog too
But what he'll never have is the love I have for you
See Dylan Scott LiveGet tickets as low as $68You might also like[Bridge]
Hope he's half the man as me
But, baby, there's no way he'll see what I see
He can pile up my stuff or burn it all down
'Cause, girl, your love's all I'll take to the ground

[Chorus]
He can have my truck, sitting out in the drive
He can have this house, everything inside
My favorite fishing hole and my old dog too
But what he'll never have is the love I have for you

Have for youEmbed"
One Man Band,Old Dominion,Country,"12 ContributorsOne Man Band Lyrics[Verse 1]
Been flyin' solo for so long
Nobody's singin' the harmony
Up there just me and my shadow
No bass, no guitar, no tambourine

[Pre-Chorus 1]
And I found you like a melody
You were singin' in the same key as me
We had ‘em dancin' in the streets

[Chorus]
I don't wanna be a one man band
I don't wanna be a rolling stone, alone
Puttin' miles on a run-down van
Baby, we can take our own show on the road
I'll lay down the beat, you'll carry the tune
We'll get tattoos, and we'll trash hotel rooms
Baby, take my hand
I don't wanna be a one man band
No

[Verse 2]
I wanna run down your wild dreams
And I wanna chase every high with you
Count every rip in these old jeans
We'll never learn how to sing the blues
See Old Dominion LiveGet tickets as low as $67You might also like[Pre-Chorus 2]
If I'm gonna be famous
Girl, I wanna be famous with you
We got our own little groove

[Chorus]
I don't wanna be a one man band
I don't wanna be a rolling stone, alone
Puttin' miles on a run-down van
Baby, we can take our own show on the road
I'll lay down the beat, you'll carry the tune
We'll get tattoos, and we'll trash hotel rooms
Baby, take my hand
'Cause I don't wanna be a one man band

[Bridge]
When the spotlight goes cold, and the curtains come down
The chairs are all stacked, and there's no one around
And nobody's payin', we’ll still be playin'

[Chorus]
I don't wanna be a one man band
I don't wanna be a rolling stone, alone
Puttin' miles on a run-down van
Baby, we can take our own show on the road
I'll lay down the beat, you'll carry the tune
We'll get tattoos, and we'll trash hotel rooms
Baby, take my hand
'Cause I don't wanna be a one man band
I don't wanna be a one man band7Embed"
Straight and Narrow,Sam Barber,Country,"6 ContributorsStraight and Narrow Lyrics[Verse 1]
When there's a storm ragin' in your soul
You gotta thank God that you're still growin' old
If them demons you're fightin' won't go away
Drop on your knees and pray

[Chorus]
Life can get hard sometimes, I know
You gotta get up and walk the straight and narrow
When they're chasin' you down with an old bloodhound
And you're runnin' through the fields for your life
You gotta get up, son, I know they're gunnin' for ya

[Verse 2]
Don't let the thoughts of yesterday
Crowd out the visions of today
Don't let your past define your name
We will all be judged the same someday

[Chorus]
Life can get hard sometimes, I know
You gotta get up and walk the straight and narrow
When they're chasin' you down with an old bloodhound
And you're runnin' through the fields for your life
You gotta get up, son, I know they're gunnin' for ya
You might also like[Outro]
When they're chasin' you down with an old bloodhound
And you're runnin' through the fields for your life
You gotta get up, son, I know they're gunnin' for yaEmbed"
Watermelon Moonshine,Lainey Wilson,Country,"11 ContributorsWatermelon Moonshine Lyrics[Verse 1]
It was right after senior year
Just before the summer disappeared
We went a-ridin' them old farm ruts
Hangin' out on the gate of his truck
We threw a blanket 'neath the sunset
Bein' brave as eighteen gets
We gave each other more than our hearts
With the help of a mason jar

[Chorus]
Drinkin' watermelon moonshine
Cut the burn with a little lime
Parkin' back in them kudzu vines
I was his and every bit of that boy was minе
Too young to know what love was
But we werе learnin' on a sweet buzz
There's never nothin' like the first time
And mine's always gonna taste like
Watermelon moonshine

[Verse 2]
I don't remember where we got it from
I just remember feelin' all grown up
Takin' pulls like it ain't no thing
Never told him it was my first drink
But I told him that he was the one
You're so sure when you're that young
You think you got it all figured out
And now I laugh when I think about
See Lainey Wilson LiveGet tickets as low as $29You might also like[Chorus]
Drinkin' watermelon moonshine
Cut the burn with a little lime
Parkin' back in them kudzu vines
I was his and every bit of that boy was mine
Too young to know what love was
But we were learnin' on a sweet buzz
There's never nothin' like the first time
And mine's always gonna taste like
Watermelon moonshine

[Bridge]
I thought that high would last forever
But that ain't what it does
Maybe we were drunk in love
Or maybe we were just

[Chorus]
Drinkin' watermelon moonshine
Cut the burn with a little lime
Parkin' back in them kudzu vines
I was his and every bit of that boy was mine
Too young to know what love was
But we were learnin' on a sweet buzz
There's never nothin' like the first time
And mine's always gonna taste like
Watermelon moonshine
Watermelon moonshine1Embed"
Religiously,Bailey Zimmerman,Country,"7 ContributorsReligiously Lyrics[Verse 1]
I went lookin' at pictures I didn't wanna see
They brought back memories
You look happy, I guess, got the life that you wanted
But it ain't with me
You would think by now that I wouldn't care
It's been a couple years and, yeah, I've had my share
Of other broken-up hearts, but I only shed real tears over ours

[Chorus]
And now I'm in this cold bright light
And this don't even feel like life
'Cause I don't have the only woman who believed in me
Religiously
And now I'm in the back of the church
Prayin' just to stop the hurt
'Cause I don't have the only woman who was there for me
Religiously

[Verse 2]
Remember watchin' you play me our song on guitar
I thought I'd marry you
Act like I'm happier now, but all of my friends know
That ain't the truth
And lately life's been good to me
Mama's healthy and I'm helpin' out the whole family
Lotta people know my name, I made a little change
But that don't mean nothin'
See Bailey Zimmerman LiveGet tickets as low as $12You might also like[Chorus]
'Cause now I'm in this cold bright light
And this don't even feel like life
'Cause I don't have the only woman who believed in me
Religiously
And now I'm in the back of the church
Prayin' hard just to stop the hurt
'Cause I don't have the only woman who was there for me
Religiously

[Bridge]
You brought me to God and I put you through hell
You were all about us, I was all about myself
What kind of man would lose a woman like that?
If my soul could be forgiven, I would give it all back

[Chorus]
Now I'm in this cold bright light
And this don't even feel like life
'Cause I don't have the only woman who believed in me
Religiously
And now I'm in the back of the church
Beggin' God just to stop the hurt
'Cause I don't have the only woman who believed in me
Religiously
[Outro]
I ain't got the only woman who was there for me
ReligiouslyEmbed"
Night Shift,Jon Pardi,Country,"17 ContributorsNight Shift Lyrics[Verse 1]
It's been a wreck me week
Sixty plus from dawn to dusk
In the red dirt heat
Busting it up for a couple of bucks
But it ain't no thing
Just another day 'til I'm on my way
To them cool, cool sheets and you and me

[Chorus]
Working on the night shift, baby
Dying for your touch like crazy
Racking up the overtime hours
Loving how we're working on the night shift, baby

[Verse 2]
Gonna rock it right
No need to talk, I know what you want
And what you like
'Cause I do too, yeah
I love how you leave on the lights
Not a thing between you and me
And it feels so nice when you and I are

[Chorus]
Working on the night shift, baby
Dying for your touch like crazy
Racking up the overtime hours
Loving how we're working on the night shift, baby
See Jon Pardi LiveGet tickets as low as $46You might also like[Bridge]
Yeah, yeah
It's been a wreck me week
Oh, but who needs sleep?

[Chorus]
When you're working on the night shift, baby
Dying for your touch like crazy
Racking up the overtime hours
Loving how we're working on the night shift, baby
Loving how we're working on the night shift
Loving how we're working on the night shift
Working on the night shift, baby2Embed"
Broken Halos,Chris Stapleton,Country,"18 ContributorsBroken Halos Lyrics[Refrain]
Seen my share of broken halos
Folded wings that used to fly
They've all gone wherever they go
Broken halos that used to shine

[Verse 1]
Angels come down from the heavens
Just to help us on our way
Come to teach us, then they leave us
And they find some other soul to save

[Refrain]
Seen my share of broken halos
Folded wings that used to fly
They've all gone wherever they go
Broken halos that used to shine
Broken halos that used to shine

[Verse 2]
Don't go looking for the reasons
Don't go asking Jesus why
We're not meant to know the answers
They belong to the by and by
They belong to the by and by
See Chris Stapleton LiveGet tickets as low as $20You might also like[Refrain]
Seen my share of broken halos
Folded wings that used to fly
They've all gone wherever they go
Broken halos that used to shine
Broken halos that used to shine
Broken halos that used to shine
Broken halos that used to shine6Embed"
Wagon Wheel,Darius Rucker,Country,"43 ContributorsWagon Wheel Lyrics[Verse 1]
Heading down south to the land of the pines
I'm thumbing my way into North Caroline
Staring up the road and pray to God I see headlights
I made it down the coast in seventeen hours
Picking me a bouquet of dogwood flowers
And I'm a-hoping for Raleigh, I can see my baby tonight

[Chorus]
So rock me, mama, like a wagon wheel
Rock me, mama, any way you feel
Hey, mama, rock me
Rock me, mama, like the wind and the rain
Rock me, mama, like a southbound train
Hey, mama, rock me

[Verse 2]
Running from the cold up in New England
I was born to be a fiddler in an old time string band
My baby plays a guitar, I pick a banjo now
Oh, north country winters keep a-getting me down
Lost my money playing poker so I had to leave town
But I ain't turning back to living that old life no more

[Chorus]
So rock me, mama, like a wagon wheel
Rock me, mama, any way you feel
Hey, mama, rock me
Rock me, mama, like the wind and the rain
Rock me, mama, like a southbound train
Hey, mama, rock me
See Darius Rucker LiveGet tickets as low as $40You might also like[Verse 3]
Walking to the south out of Roanoke
I caught a trucker out of Philly had a nice long toke
But he's a heading west from the Cumberland gap
To Johnson City, Tennessee
And I got to get a move on before the sun
I hear my baby calling my name and I know that she's the only one
And if I die in Raleigh at least I will die free

[Chorus]
So rock me, mama, like a wagon wheel
Rock me, mama, any way you feel
Hey, mama, rock me
Rock me, mama, like the wind and the rain
Rock me, mama, like a southbound train
Hey, mama, rock me
So rock me, mama, like a wagon wheel
Rock me, mama, any way you feel
Hey, hey, mama, rock me
Mama, rock me
Mama, rock me
Rock me, mama, like the wind and the rain
Rock me, mama, like a southbound train
Hey, hey, mama, rock me
You can rock me
Rock me32Embed"
What My World Spins Around,Jordan Davis,Country,"6 ContributorsWhat My World Spins Around Lyrics[Verse 1]
I love a first cast when the water's glass and the line starts to run
Or that first sip of a cold beer when the working week's done
I love the twilight in the morning 'fore the day wakes up
With the windows down on the first ride in a paid-up truck
And I love a slow down in a beach town with an ocean view
And I love a first fall Saturday trip down to Baton Rouge
And I love a six-string with the stars out and the campfire glow
But girl, that don't even come close

[Chorus]
To the way that it feels when you lean in and kiss me
The way that you dance when you get kinda tipsy
I'm wrapped 'round your finger like this ring I'm wearin'
That look in your eye, girl, when you catch me starin'
And I don't even know what it is, but now that I found it
I can't imagine me livin' without this
Back forty view on our piece of ground
Watching you watch the sun going down
That's what my world spins around

[Verse 2]
Well, I finally get it now, when they say you know, you know
And yeah, girl, you had me from that first hello
And the only thing better is Heaven above
But until I get there, I'll never get enough of
See Jordan Davis LiveGet tickets as low as $20You might also like[Chorus]
The way that it feels when you lean in and kiss me
The way that you dance when you get kinda tipsy
I'm wrapped 'round your finger like this ring I'm wearin'
That look in your eye, girl, when you catch me starin', and
I don't even know what it is, but now that I found it
I can't imagine me livin' without this
Back forty view on our piece of ground
Watching you watch the sun going down
That's what my world spins around

[Post-Chorus]
What my world spins around
Oh, yeah

[Chorus]
The way that it feels when you lean in and kiss me
The way that you dance when you get kinda tipsy
And I'm wrapped 'round your finger like this ring I'm wearin'
And that look in your eye, girl, when you catch me starin', and
I don't even know what it is, but now that I found it
I can't imagine me livin' without this
Back forty view on our piece of ground
Watching you watch the sun goin' down
That's what my world spins around
[Outro]
You're what my world spins around
What my world spins aroundEmbed"
The Painter,Cody Johnson,Country,"5 ContributorsThe Painter Lyrics[Verse 1]
She talks about the future like she's flippin' through a magazine
Finds the beauty in the thrown away and broken things
Gets excited about all my crazy dreams

[Verse 2]
Got every sunset that she's ever seen memorized
Saves them away for a rainy day or stormy night
The sky is brighter lookin' at it through her eyes

[Chorus]
I don't remember
Life before she came into the picture
Brought the beauty I was missin' with her
Showed me colors I ain't ever seen
She took chances
With every wall I built, she saw a canvas
I thank God every day for how He made her
My life was black and white, but she's the painter

[Verse 3]
She reminds me that it ain't too late to start again
Fine is good, but you need some blue every now and then
How'd I live so long without her reckless touch?

[Chorus]
I don't remember
Life before she came into the picture
Brought the beauty I was missin' with her
Showed me colors I ain't ever seen
She took chances
With every wall I built, she saw a canvas
I thank God every day for how He made her
My life was black and white, but she's the painter
See Cody Johnson LiveGet tickets as low as $15You might also like[Chorus]
I don't remember
Life before she came into the picture
Brought the beauty I was missin' with her
Showed me colors I ain't ever seen
She took chances
With every wall I built, she saw a canvas
I thank God every day for how He made her
My life was black and white, but she's the painter

[Outro]
She's the painterEmbed"
Need A Favor,Jelly Roll,Country,"11 ContributorsNeed A Favor Lyrics[Chorus]
I only talk to God when I need a favor
And I only pray when I ain't got a prayer
So who the hell am I, who the hell am I to expect a savior, oh
If I only talk to God when I need a favor?
But, God, I need a favor

[Verse 1]
I know amazin' grace, but I ain't been livin' them words
Swear I spend most Sundays
Drunk off my ass than I have at church
Hard cover King James
Only been savin' dust on the nightstand
And I don't know what to say
By the time I fold my hands

[Chorus]
I only talk to God when I need a favor
And I only pray when I ain't got a prayer
So who the hell am I, who the hell am I to expect a savior, oh
If I only talk to God when I need a favor?
But, God, I need a favor

[Post-Chorus]
Amen, amen
See Jelly Roll LiveGet tickets as low as $55You might also like[Verse 2]
Yeah, I owe you more than one
And beggars can't be choosers
But I'll pay for all I've done
Just pleasе don't let me lose hеr

[Chorus]
I only talk to God when I need a favor
And I only pray when I ain't got a prayer
So who the hell am I, who the hell am I to expect a savior, oh
If I only talk to God when I need a favor?
But, God, I need a favor

[Post-Chorus]
Amen, amen
Amen, amen

[Bridge]
Hangin' in there just barely
Throwin' up prayers like Hail Marys
If You're still there, Lord, spare me
Oh, my God, oh, my God, Hail Mary
Hangin' in there just barely
Throwin' up prayers like Hail Marys
If You're still there, Lord, spare me
Oh, my God, oh, my God, Hail Mary
[Chorus]
I only talk to God when I need a favor
And I only pray when I ain't got a prayer
So tell me, who the hell am I to expect a savior
When I only talk to God if I need a favor?
And, God, I need a favor

[Post-Chorus]
Amen
God, I need a favor
Woah
AmenEmbed"
Springsteen,Eric Church,Country,"33 ContributorsSpringsteen Lyrics[Verse 1]
To this day when I hear that song
I see you standin' there on that lawn
Discount shades, store bought tan
Flip flops and cut-off jeans
Somewhere between that setting sun
I'm on Fire and Born to Run
You looked at me and I was done
And we're, we're just getting started

[Verse 2]
I was singin' to you, you were singin' to me
I was so alive, never been more free
Fired up my daddy's lighter and we sang
Oohh
Stayed there 'til they forced us out
And took the long way to your house
I can still hear the sound of you sayin' ""don't go""

[Chorus]
When I think about you, I think about 17
I think about my old Jeep
I think about the stars in the sky
Funny how a melody sounds like a memory
Like the soundtrack to a July Saturday night
Springsteen
See Eric Church LiveGet tickets as low as $235You might also like[Verse 3]
I bumped into you by happenstance
You probably wouldn't even know who I am
But if I whispered your name I bet there'd still be a spark
Back when I was gasoline
And this old tattoo had brand new ink
And we didn't care what your mom would think
About your name on my arm

[Verse 4]
Baby, is it spring or is it summer?
The guitar sound or the beat of that drummer
You hear sometimes late at night
On your radio
Even though you're a million miles away
When you hear Born in the USA
You relive those glory days
So long ago

[Chorus]
When you think about me, do you think about 17
Do you think about my old Jeep
Think about the stars in the sky
Funny how a melody sounds like a memory
Like a soundtrack to a July Saturday night
Springsteen
Springsteen
[Bridge]
Woah-oh-oh-oh
Woah-oh-oh-oh
Woah-oh-oh-oh-oh-oh-oh
Woah-oh-oh-oh
Woah-oh-oh-oh
Woah-oh-oh-oh-oh-oh-oh

[Refrain]
Funny how a melody sounds like a memory
Like a soundtrack to a July Saturday night
Springsteen
Springsteen
Woah Springsteen

[Outro]
Woah-oh-oh-oh
Woah-oh-oh-oh
Woah-oh-oh-oh-oh-oh-oh
Woah-oh-oh-oh
Woah-oh-oh-oh
Woah-oh-oh-oh-oh-oh-oh
Woah-oh-oh-oh
Woah-oh-oh-oh
Woah-oh-oh-oh-oh-oh-oh
Woah-oh-oh-oh
Woah-oh-oh-oh
Woah-oh-oh-oh-oh-oh-oh14Embed"
