track,artist,genre,lyrics
How We Roll,Ciara,RnB,"16 ContributorsHow We Roll Lyrics[Intro: Ciara, Chris Brown]
He say that I blow his mind every time I'm activated
You just tryna catch a vibe, CiCi got you fascinated (Breezy)
Jump up in a brand new ride, BM-dub, we ridin', baby (Yeah)
I ain't gonna tell you lies

[Chorus: Ciara, Chris Brown]
That's just how we roll (You know what it is, what it is)
How we roll (You know what it is, what it is)
That's just how we roll (You know what it is, what it is)
How we roll (Hey, baby, you know what it is, what it is)

[Verse 1: Ciara]
Yeah, top off, summer in the wind
You look at me like that again, we make another kid
You my heart, I'm your rib
If I ever had to for you, I would do a bid
And I can tell that you're ready
Three, two, one, it's goin' down like confetti
Pour the ten to one shots again
If we film it on the phone, promise that we're gonna trend

[Pre-Chorus: Ciara]
Ooh, don't kill the vibes, you know what I like, daddy
Ooh, it's on tonight, I'm talkin' on sight
You might also like[Chorus: Ciara & Chris Brown, Chris Brown, Ciara]
That's just how we roll (You know what it is, what it is)
How we roll (You know what it is, like that, that, that)
That's just how we roll (Ooh, yeah, you know what it is, what it is, yeah)
How we roll (You know what it is, like that, that, that, Breezy)

[Verse 2: Chris Brown, Ciara]
It's been a minute (Yeah) since I been in it (Yeah)
Swimmin' in it (Yeah, yeah, yeah, yeah, ooh)
You should be livin' in it (Yeah)
Keep your hands all over me, and never
Never worry (Yeah), keep you coming (Yeah)
That's how you love it (Oh, baby)
Who cares if we in public? (No)
When it comes to you, I'm with whatever
You know I (I), I won't kill your vibe (No)
I know what you like (On your mark, get, set)
Get ready

[Pre-Chorus: Chris Brown]
Ooh, yeah, yeah, yeah
It's on tonight, I'm talkin' on sight (Alright)

[Chorus: Ciara & Chris Brown, Ciara, Chris Brown]
That's just how we roll (You know what it is, how it is, yeah, what it is, that's how we)
How we roll (Roll, you know what it is, just like that, that, that)
That's just how we roll (Roll, yeah, you know what it is, what it is, like that, that, that, that's how we)
How we roll (You know what it is, yeah, baby, like that, that, that)
[Post-Chorus: Ciara, Ciara & Chris Brown, Chris Brown]
Yeah, yeah
Baby, do that to me like that (That's how we roll, like that)
Know I like it when you do it like that (Like that)
And baby, yeah, that's how we rollin' like that (Like that, that's just how we roll)
Baby, yeah, that's how we do it like that, that, that
Oh, baby do that to me like that (Come on, that's how we roll)
Know I like it when you do it like that
And baby, yeah, that's how we rollin' like that (That's just how we roll)
Yeah, I love just how we do it like that, that, that
Baby, do that to me like that (That's how we roll, sexy)
Know I like it when you do it like that (Do it to me, sexy girl)
Baby, yeah, that's how we rollin' like that (That's just how we roll)
Baby, yeah, that's how we rollin' like that, that, that (Do it, lick it)
Do that to me like that (Trippin', let me kiss it)
Know I like it when you do it like that (Eat that pussy in the kitchen)
And baby, yeah, that's how we rollin' like that (Baby girl, can you feel it?)
Yeah, I love it how we do it like that, that, that (You gon' be gone for a minute)
That, that, that, thatEmbed"
"It’s Not Me, It’s You (feat. Destin Conrad)",Mahalia,RnB,"9 ContributorsIt’s Not Me, It’s You Lyrics[Intro: Mahalia]
Uh, uh, yeah, uh
Oh, no, no, no, no, no, no, babe
Uh, yeah

[Verse 1: Mahalia]
Crazy
If I had a penny for all the times a man nearly made me crazy (Huh)
Well, heck I'd be a millionaire by now
Maybe even as early as a baby
From the classroom to the break time
Kiss Chase in the playground
Hoping that he picks me in
Heads Down, Thumbs Up
He don't show no love
It don't change when you grow up
Just physical, still no love

[Pre-Chorus: Mahalia]
Men will always love the chase, yeah
They still wanna kiss you and then run away (Kiss you and run away)
Ain't nothing changed if it's always the same
Then it can't bе me to blame

[Chorus: Mahalia]
How long am I gonna pretеnd that I'm the one who's gotta improve? (Gotta improve)
You know the saying, ""It's not you, it's me""
Well, I got news, it's not me, it's you
How long am I gonna pretend that I'm the one who's gotta improve? (Gotta improve)
You know the saying, ""It's not you, it's me""
Well, I got news, it's not me, it's, it's not me, it's
See Mahalia LiveGet tickets as low as $49You might also like[Verse 2: Mahalia]
You, yes, it's you, boy, I figured it out
All this time I beat around the bush
But now you're bringin' it out of me
True, you really started every fight
Always in the right
You've used up all your lies
With me, that set me free (Yeah)
I learned to see clearly
What's right and wrong, you had me fooled, nearly
It's nice to know that movin' on, I'm not the one to blame

[Chorus: Mahalia]
How long am I gonna pretend that I'm the one who's gotta improve? (Gotta improve)
You know the saying, ""It's not you, it's me""
Well, I got news, it's not me, it's you
How long am I gonna pretend that I'm the one who's gotta improve? (Gotta improve)
You know the saying, ""It's not you, it's me""
Well, I got news, it's not me, it's, it's not me, it's

[Instrumental Break]

[Verse 3: DESTIN CONRAD]
Crazy that you lucked up where you found me
And you makin' it seem like you really tryna play me, ayy, yeah
Like you wasn't the one, who
Blew that flame out like a smokin' gun
I let you in, you made it clear
That I wasn't the issue, baby, you got some shit to deal with
Promise I don't feel a way
And it's probably 'cause I'm not the one to blame
[Chorus: Mahalia & DESTIN CONRAD]
How long am I gonna pretend that I'm the one who's gotta improve? (Who's gotta improve)
You know the saying, ""It's not you, it's me""
Well, I got news, it's not me, it's you
How long am I gonna pretend that I'm the one who's gotta improve? (Gotta improve)
You know the saying, ""It's not you, it's me""
Well, I got news, it's not me, it's, it's not me, it's youEmbed"
Tell Me It's Over (feat. Summer Walker & 6LACK),Jacquees,RnB,"10 ContributorsTell Me It’s Over Lyrics[Intro: Jacquees]
Haus
That nigga nice
Yeah

[Verse 1: Jacquees]
I just made a right on Northside Drive
Seen that lil' Jeep, thought I seen you from behind
Pulled up on the side, wasn't you in the window
You still on my mind, clear to see, plain and simple
And I started thinkin' 'bout the way it used to be
I was on the phone, we got call history
Fuckin' with each other for so long it gets to me
I'm reminded by the signs that we just aren't meant to be (Mm)

[Chorus: Jacquees]
Tell me it's over without sayin' it's over (Woah, woah)
Tell me it's over without sayin' it's over (Woah, woah)
'Cause I can't take no more, yeah (No morе)
Tell me it's over without sayin' it's ovеr (Woah, woah)
Tell me it's over without sayin' it's over (Woah, woah)
Tell me

[Verse 2: Jacquees, Summer Walker & Both]
Uh, we been through it all
Late night flights and late night fights
Fucked up the mall
Ain't no price, your love was priceless
I know I fucked up
You caught me lyin' too many times before
Took me back, I did it more (Yeah)
I was convinced you was gettin' even and gettin' hit
By another nigga, yeah, I was sick
I'm a player, but I gotta admit
Yeah, you hurt me bad, I know it ain't as bad as I hurt you
Say you was done, I act like I never heard you, oh
Don't tell me (Oh)
You might also like[Chorus: Jacquees, Summer Walker & Both]
Tell me it's over without sayin' it's over (Woah, woah)
Tell me it's over without sayin' it's over (Woah, woah)
'Cause I can't take no more, yeah (No more, oh)
Tell me
Tell me it's over if you say it
Tell me it's over if you say it
Uh

[Verse 3: Summer Walker]
Called me outside just to talk, but I'm sayin'
You done fucked on everythin', I could name 'em, you was trippin'
I'm in my feelings, you wanna fix it
Talkin' 'bout all the time tryna play around with my mind, yeah (Yeah)
Yeah, yeah, baby, it's over 'cause I'm sayin' it is (Woah, woah)
I'm with that old shit, I ain't fight no more bitches (No)
And I ain't takin' no more (More)
Done with that shit, yeah, yeah, over (Done with that shit)

[Chorus: Jacquees & 6LACK]
Tell me it's over without sayin' it's over (Woah, woah)
Tell me it's over without sayin' it's over (Woah, woah)
'Cause I can't take no more, yeah (No more)
Tell me
Tell me it's over without sayin' it's over (Woah, woah)
Tell me it's over without sayin' it's over (Woah, woah)
Tell me (Yeah, uh, yeah)
[Verse 4: 6LACK]
We went through some trials (Trials), know it's been a while (While)
Them niggas ain't study, I know what you 'bout ('Bout)
If that make you proud (Proud), then I'm bowin' out
Signin' off, loggin' out, bye
No more questions, no more askin' why
I'm done with the makeup, breakups (Breakups)
How you gon' take that pay cut? (Pay cut)
Had you in my favor (Favor)
Gotta get that minimum wage up
I can't stay love, no way, look (Way, look)
Won't be there when you wake up
Never trippin' on the facts (Facts)
Time to burn it like a pack (Pack)
The life I live is the life I made
What you won't have is the love I gave
And so I say, so I say, so I say

[Chorus: 6LACK & Jacquees]
Tell me it's over without sayin' it's over (Woah, woah)
Tell me it's over without sayin' it's over (Woah, woah)
'Cause I can't take no more, yeah (No more)
Tell me
Tell me it's over without sayin' it's over (Without, woah, woah)
Tell me it's over without sayin' it's over (Tell me it is, woah, woah)
Tell meEmbed"
Go Baby,Cleo Sol,RnB,"6 ContributorsGo Baby Lyrics[Chorus]
Go baby, go baby, go baby
Hope that God forgives your sins, your sins, your sins, your sins
Go baby, go baby, go baby
Gotta keep moving on even though you're not here, not here, not here, not here
Go baby, go baby, go baby
Hope that God forgives your sins, your sins, your sins, your sins
Go baby, go baby, go baby
I keep moving on even though you're not here, not here, not here

[Verse]
Lost your hope again
Still looking for a friend
Have to grow up and face what's inside
I just hope that you never stop trying, ooh

[Chorus]
Go baby, go baby, go baby
Hope that God forgives your sins, your sins, your sins, your sins
Go baby, go baby, go baby
Gotta keep moving on even though you're not here, not here, not herе, not here
Go baby, go baby, go baby
Hope that God forgivеs your sins, your sins, your sins, your sins
Go baby, go baby, go baby
I keep moving on even though you're not here, not here, not here
You might also like[Bridge]
Love, I need you to know you are special
Love, I need you to know you are special
Love, I need you to know you are special
Love, I need you to know you are special

[Outro]
Go baby, go baby, go baby
Hope that God forgives your sins1Embed"
That's You,Lucky Daye,RnB,"15 ContributorsThat’s You Lyrics[Verse 1]
Money, diamonds, house in different cities
I'm livin' my wildest dreams
Crooked smile, I'm in with all the power
Can do what I want but I'm empty
Baddies, got 'em, model movie options
To makin' a movie scene
You know all the game but what's it really mean?

[Pre-Chorus]
Lord knows I try to give up
Tried what I thought could be love
Tried takin' chances and chance brought me down to my knees

[Chorus]
Girl, I been so dumb
Don't wanna be a fool out of love all alone
Girl, I been so wrong
Buyin' up the world just to make it feel like home
I been numb, so numb
Spendin' every dime to gеt everything I want
Therе's only one thing missing in life
That's you

[Verse 2]
Cocoa butter, Baccarat on covers
I smell it on my sheets
I heard you say that you might love another
It filled up my world with envy
And I can't stop reminiscing
When we relivin' the moment when you were meant for me
But all this fame and fortune can't afford me what I need
You might also like[Pre-Chorus]
Lord knows I try to give up
But all I can see is what was
I tried takin' chances but chance brought me down to my knees

[Chorus]
I been so dumb
Don't wanna be a fool out of love all alone
Girl, I been so wrong
Buyin' up the world just to make it feel like home
I been numb, so numb
Spendin' every dime to get everything I want
There's only one thing missing in life
That's you

[Bridge]
That's you
That's you
That's you

[Chorus]
Girl, I been so dumb
Don't wanna be a fool out of love all alone
I been so wrong
Buyin' up the world just to make it feel like home
I been numb, so numb
Spendin' every dime to get everything I want
There's only one thing missing in life
That's you
[Outro]
That's you
You know it's true (That's you)
I can't help myself, you know it's you, oh (That's you)
Girl, it's you (That's you)
Girl, it's you (That's you)
Girl, it's you (That's you)
Ah, ha
You know it, you know it (That's you)
You know it, you know it, you know it, you know it
You know it's true (That's you)
It's always, it's always been you (That's you)
Forever, forever, with you (That's you)
Ooh, that's you
Yeah, ooh, that's you2Embed"
My Phone Can Die,Rory,RnB,"4 ContributorsMy Phone Can Die Lyrics[Intro: Ari Lennox]
My phone can die
X videos, don't need it in my life

[Verse 1: Ari Lennox]
Real deal, love in it
Long when you deep in it
Mesmerizing flesh, 3D
Want you next to me

[Chorus: Ari Lennox]
Phone can die
I don't need nothin' but you and I, I (No, no)
My phone can die (Ooh, ooh)
I don't need nothin' but you and I (Ooh, ooh)
Oh-oh (Ooh)

[Verse 2: James Fauntleroy]
You know my love can get long winded
Don't hesitate, send it
Silence, the one I want is here, she's right here

[Chorus: James Fauntleroy, Ari Lennox, Both]
Phone can die (Ooh)
I don't need nothin' but you and I
Oh, I (Oh, oh)
My phone can die (Ooh, ooh)
I don't need nothin' but you and I (Ooh, ooh)
Oh, I
My phone can die (Ooh, ooh)
I don't need nothin' but you and I (Ooh, ooh)
Oh, I
You might also like[Bridge: Ari Lennox]
I want real deal
3D, you and me
The streets, ee-ee
Phonе can die, oh
Phone can die

[Outro: Ari Lennox]
Go for that bеtter life
And fuck that bitter life
And if you want it nice
And in my hands at night
And then your friends are nice
And when your friends are nice
And see me on the fly
It can be you and I (I)Embed"
Back to your Place,October London,RnB,"3 ContributorsBack to Your Place Lyrics[Intro]
Ah, baby
I been looking at you all night

[Verse 1]
Oh, baby, I've been thinking 'bout you (Thinkin' 'bout you)
And all of the things I want to do
Once the day becomes the night
Said I've been patient, and I've been kind
Oh, but my body is runnin' out of time
You said your clock on your walls is tickin'
So let me give you what you been missing

[Chorus]
So she said
Take me, oh, take me, baby
Oh, baby
Take me back to your place
Ooh, your place of residence
So she said
Take me, oh, take me, baby
Oh, baby
Take me back to your place
Ooh, your place of residence

[Verse 2]
Oh, I've been waiting, baby
Waiting for a long time (Waiting on you)
For your heart to be mine
Oh, before someone else comes to mind
But when you
Oh, when you told me
That I was the one, girl (Oh, baby)
I took every hour and minute, babe
Just to make sure that everything is right
You might also like[Chorus]
So she said
Take me, oh, take me, baby
Oh, baby
Take me back to your place (Your place)
Ooh, your place of residence (Oh, your place, baby)
So she said
Take me, oh, take me, baby
Oh, baby
Take me back to your placeEmbed"
Treasure In The Hills,Leon Thomas,RnB,"7 ContributorsTreasure In The Hills Lyrics[Verse 1]
Play by the rules
But l'd rather do something naughty
Let's find a room, woah
Inside this after party

[Refrain]
Been on a hunt, found what I want
Found what I want in you

[Chorus]
I found treasure in the hills
I found treasure in the hills
I found treasure in the hills
I found treasure in the hills
Chase more than diamonds and gold
I'm trying to find me a soul
Chase more than diamonds and gold
I'm trying to find me a soul

[Verse 2]
You live alone
Now it's just you and your shadow
Let's change that up
Let's take it into tomorrow
You might also like[Refrain]
Been on a hunt, found what I want
Found what I want in you

[Chorus]
I found treasure in the hills
I found treasure in the hills
1 found treasure in the hills
I found treasure in the hills
Chase more than diamonds and gold
I'm trying to find me a soul
Chase more than diamonds and gold
I'm trying to find me a soulEmbed"
Waterfall (I Adore You),Yebba,RnB,"8 ContributorsWaterfall (I Adore You) Lyrics[Verse 1]
Deep in my mind
Even my inner critic
Is still a mystic
You're unrefined
Raw and uncut like the prisms
Bending time to time

[Pre-Chorus]
Mirrors break, they multiply
Fuck what they say
These feelings don't subside
Obsessions fade
Over time
But what remains, love is whatever we make it tonight

[Chorus]
Did they mention the pride before the fall?
('Cause I would risk it all for you)
What they say 'bout the writings on the wall?
(No clue, baby, I adore you)

[Post-Chorus]
Baby, I adore (I adore)
I adore you
Baby I adorе (I adore)
You might also like[Verse 2]
Find a couple threads
Thеy run from my head through this mattress
As it spins on its axis
You're heavy as lead
Pressing that cross on your necklace
Against my chest

[Pre-Chorus]
Mirrors break, just to multiply
Obsessions fade
Over time
What can I say?
These feelings don't subside
And what remains, love is whatever we make it tonight

[Chorus]
Did they mention the pride before the fall?
('Cause I would risk it all for you)
What they say 'bout the writings on the wall?
(No clue, baby, I adore you)

[Post-Chorus]
Baby, I adore (I adore)
I adore you
Baby I adore (I adore)2Embed"
Be My Summer,Snoh Aalegra,RnB,"8 ContributorsBe My Summer Lyrics[Chorus]
Can you be my summer
Protect me from the rain?
Be my summer
Protect me from the rain (Protect me from the rain, oh)
Be my summer
Protect me from the rain
(Can you) be my summer
Protect me?

[Verse 1]
I tried to run away
There's no escape, you've taken tenure in my heart
I can't change how I feel
Tried movin' on but I'm right here where we left off
Naked walls at my place, where you met me
Now they're dressed up with my mama's poetry
You were oceans away but you fell deep
Didn't you?
I know we both not sure what lies ahead of us

[Chorus]
Can you (Can you, you?) be my summer
Protect me from the rain?
Be my summer
Protect me from the rain (Protect me from the rain, oh)
Be my summer
Protect me from the rain
(Can you) be my summer
Protect me?
See Snoh Aalegra LiveGet tickets as low as $102You might also like[Verse 2]
Driftin', I'm castaway
Just like the waves, you get your way and leave me lost
Come show me how you feel
We're runnin' out of time, and I don't wanna see this fall
All these walls that you've built, they don't scare me
I can stop these withdrawals, if you let me
I know you tried but you couldn't forget me
Didn't you?
I know we're both not sure what lies ahead of us

[Chorus]
But can you (Can you?) be my summer
Protect me from the rain? (The rain)
Be my summer
Protect me from the rain (Protect me from the rain, oh)
Be my summer
Protect me from the rain
(Can you) be my summer
Protect me?2Embed"
Big Steppa,Amaarae,RnB,"8 ContributorsBig Steppa Lyrics[Verse 1]
You wanna desert me like I been auctioned off
See I had to, to be pressure just to be option one
They hate on you
And you wavy but they don’t war with ya
Big hottie say they touch ya but they don’t talk to ya

[Pre-Chorus]
She never asked what you want
She can’t love like I do
If she don't say me too
I need you to me too
Ooh baby can't take you home
You got ways bout you too
You gone make me break rules
Ooh Oooh

[Chorus]
Big Steppa
Make up the room, come get her
They know your body be pressure
Gotta pay out the fee don’t waiver
Don’t waiver
My baby Big Steppa
Make up the room, come get her
They know your body be pressure
Gotta pay out the fee don’t waiver, don't waiver
You might also like[Post-Chorus]
Ooh show me how love was made from you
Ooh give you the time they take from you

[Verse 2]
You must to break my heart oo
You must to spend my cash oo
Do me like this like that oo
Bring my baby back oo

[Pre-Chorus]
She never asked what you want
She can’t love like I do
If she don't say me too
I need you to me too
Ooh baby can't take you home
You got ways bout you too
You gone make me break rules
Ooh ooh

[Chorus]
Big Steppa
Make up the room, come get her
They know your body be pressure
Gotta pay out the fee don’t waiver
Don’t waiver
My baby Big Steppa
Make up the room, come get her
They know your body be pressure
Gotta pay out the fee don’t waiver
Don’t waiver
[Post-Chorus]
Ooh show me how love was made from you
Ooh give you the time they take from you

[Outro]
Big SteppaEmbed"
22,JayO,RnB,"11 Contributors22 Lyrics[Chorus]
You're 22
Too hot to handle
Girl, I wanna handle you
Put my hands upon you, baby
You're 22
Too hot to handle
Girl, I wanna handle you
Put my hands upon you, baby

[Verse]
Say you like to really ride
Girl, I really know your type is me
Wondering if you and I could be
Kim K and Kanye crazy
Just maybe
Constant crazy with my lady
You got something that I'm interested in
Just maybe

[Chorus]
You're 22
Too hot to handle
Girl, I wanna handle you
Put my hands upon you, baby
You're 22
Too hot to handle
Girl, I wanna handle you
Put my hands upon you, baby
You might also like[Bridge]
22 going on 23
You look prettier when you're fucking with me
I'm in your city, I'ma show you what it means
To be loved, fucked
22 going on 23
You look prettier when you're fucking with me
I'm in your city, I'ma show you what it means
To bе loved, fucked

[Chorus]
You're 22
Too hot to handlе
Girl, I wanna handle you
Put my hands upon you, baby
You're 22
Too hot to handle
Girl, I wanna handle you
Put my hands upon you, baby1Embed"
Lipstick Lover,Janelle Monáe,RnB,"17 ContributorsLipstick Lover Lyrics[Intro]
Lipstick lover, lover, lover, lover, lover, lover, lover
My lipstick lover, lover, lover

[Verse 1]
I like lipstick on my neck
It let me know I'm your number one select
I like lipstick on my neck
Hands around my waist so you know what's comin' next
I wanna feel your lips on mine
I just wanna feel a little tongue
We don't have a long time

[Refrain]
Ooh, you talkin' nasty and I like it (Like it)
Whisper in my ear, only me and you can hear
I seen it from the back and I'm excited (Excited)
Tell me what you do when we walk up in the room, yeah
Hope it's something nasty, we can try it (Try it)
Bite me on my neck and you know what's comin' next
We can make a movie, I can write it (Write it)
Let's just make a move, baby

[Pre-Chorus]
'Cause for your love, I'll take my time
Just wanna feel your hips on mine
You might also like[Chorus]
I really got a thing for my lipstick lover, lover, lover, lover, lover
I'll do anything for my lipstick lover, lover, lover, lover, lover

[Verse 2]
I like lipstick on my neck
Leave a sticky hickey in a place I won't forget
I like lipstick on my neck
Baby, I'm obsessed, get me undressed
I wanna feel your lips on mine
I just wanna feel a little tongue
We don't have a long time

[Refrain]
Ooh, you talkin' nasty and I like it (Like it)
Whisper in my ear, only me and you can hear
I seen it from the back and I'm excited (Excited)
Tell me what you do when we walk up in the room, yeah
Hope it's something nasty, we can try it (Try it)
Bite me on my neck and you know what's comin' next (And you know what's coming next)
We can make a movie I can write it (Write it)
Let's just make a move, baby

[Pre-Chorus]
'Cause for your love, I'll take my time
Just wanna feel your hips on mine
[Chorus]
I really got a thing for my lipstick lover, lover, lover, lover, lover
I'll do anything for my lipstick lover, lover, lover, lover, lover
I really got a thing for my lipstick lover, lover, lover, lover, lover
I'll do anything for my lipstick lover, lover, lover, lover, loverEmbed"
Fell In Love,Marshmello,RnB,"22 ContributorsFell In Love Lyrics[Chorus: Brent Faiyaz]
You ain't fall in love with me
You fell in love with the man I could be
You ain't fall in love with me
You fell in love with your vision of me

[Verse 1: Brent Faiyaz]
She said, ""Boy, you ain't no good,"" bitch, I know
Fuck I'm 'posed to do 'bout that? I'm gon' go
I been movin' state to state, I went pro (Went pro)
Baby, plenty dough, heavy throat, shit crazy
I can ease your mind if you goin' through somethin'
That don't mean I can cure depression (Can't cure a thing)
I'll free my night if you wanna do somethin' (Do somethin')
But I'm takin' your direction

[Chorus: Brent Faiyaz]
You ain't fall in love with me
You fell in love with the man I could be
You ain't fall in love with me
You fell in love with your vision of me

[Verse 2: Brent Faiyaz]
She said ""Boy, who you been with?"" ""I been low""
Shе says she don't believе that shit, she think I'm gross
I can't even hug a bitch, she gon' know
Then fight me for the hell of it, I gotta dip, gotta go somewhere
You might also like[Bridge: Brent Faiyaz]
Have I been wrong?
Have I been gone too long to know where I belong?
Woah

[Chorus: Brent Faiyaz]
You ain't fall in love with me (Ooh)
You fell in love with the man I could be
You ain't fall in love with me (No, oh-oh, oh)
You fell in love with your vision of me1Embed"
